,title,type
0,속보 서울고검 재판부 사찰의혹 윤석열 무혐의 처분,2
1,서울고검 판사 문건 윤석열 총장에  무혐의 처분,2
2,서울고검 윤석열 판사 사찰 무혐의 처분,2
3,서울고검 윤석열 판사 사찰 무혐의 처분종합,2
4,속보 고양시 태평양무도장 명 집단감염방역조치 위반,2
5,코로나 집단감염 고양 무도장 출입관리 위반 적발,2
6,고양 태평양무도장동경식당서 집단감염 시 방역수칙 위반,2
7,고양시 무도장식당서 집단감염 발생방역수칙 위반 조사,2
8,구속 위기 백운규 혐의 부인원전 폐쇄는 국민안전 위한 것,2
9,백운규 영장기각에 급제동 월성원전 수사 계속 윗선 향할까,2
10,월성원전 의혹 백운규 구속영장 기각혐의 소명 부족,2
11,월성원전 의혹 백운규 구속심사 시간 만에 종료,2
12,광주 하루 천명 백신 접종 작전시설인력 확보 속도,2
13,일 백신 접종 앞두고 모의훈련참가자 대본 없이 진행,2
14,일 백신 접종 앞두고 모의훈련돌발상황 점검,2
15,전남도 코로나 예방접종 임박 막바지 준비,2
16,방역당국 수도권 임시검사소 일부 운영 유지 실명검사로 전환,2
17,서울역고속터미널 등 임시 선별검사소 개소 설 연휴 운영,2
18,박근혜 코로나 격리 일만에 서울구치소 복귀,2
19,박근혜 전 대통령 일 만에 퇴원해 서울구치소 복귀,2
20,앞길 구만리 대 급 공무원의 죽음수사 전환할까,2
21,숨진 채 발견된 서울시 급 공무원유퀴즈 출연자 맞다,2
22,변이 코로나 명 추가 총 명명 입국 명은 지역 전파 사례종합,2
23,전파 속도 빨라지는 변이 바이러스하루만에 명 추가,2
24,온몸 멍든 살 여아 욕조 빠져 숨져이모부가 학대 용의자,2
25,이모 집에 맡겨진 열살 여아 욕조서 숨져온몸에 멍 자국,2
26,내일부터 고속도로 휴게소 매장서 식사 금지 포장만 가능 통행료 유료,2
27,내일부터 고속도로 휴게소 포장만 가능모레부터는 통행료 유료,2
28,김해시  등급 청렴도시 청렴한 김해을 위한 보고회 개최,2
29,영도구 신규 공무원 청렴 서약식 및 청렴교육 개최,2
30,이번 설부터 고양이개 학대하면 년 징역,2
31,동물학대 처벌 강화잔인하게 죽이면 년 이하년 이하 징역,2
32,아스트라제네카 백신 만명분 일부터 받아 곧바로 접종,2
33,방역 당국 아스트라제네카 백신 일부터 접종 시작,2
34,아기욕조서 기준치 배 환경호르몬집단 소송 나서,2
35,환경호르몬 기준치 배 나온 코스마 아기욕조피해자 집단소송,2
36,트랜스젠더는 남자에서 여자가 된 사람 아닌가요,2
37,트랜스젠더  수업 중 교사가 성소수자 비하하는 발언 들어,2
38,요아리 학폭 논란침묵은 금물에세이,2
39,싱어게인 측 요아리 학폭 의혹 부인출연진 변동 없어,2
40,월성원전 의혹 백운규 전 장관 구속 전 피의자 심문 종료,2
41,백운규 구속영장 기각원전수사 제동 걸렸다,2
42,백운규 전 산자부 장관 영장실질심사 종료구속여부 일 새벽쯤 나올듯,2
43,월성 원전 의혹 백운규 전 산업부 장관 구속영장 기각,2
44,전세버스 타고 제주 여행 코로나 확진설 연휴 방역 비상,2
45,제주 명 신규 확진자 발생관광객아라동 일가족 접촉자,2
46,제주 관광객 여행중 확진 판정 설연휴 방역 비상,2
47,패키지 여행 왔다 확진됐는데서로 모르니 방역 위반 아니다,2
49,살 조카 이틀간 때리고 물고문으로 죽인 이모 훈육이었다,2
50,이모 집 맡겨진 살 여자아이 숨져온몸에 멍자국,2
51,이모집 맡겨진 살 아이 온몸 멍든채 욕조서 숨져폭행 조사,2
52,경남 신규 명김해 변이 바이러스 검사,2
53,경남 명 추가 확진외국인 확진자 변이 바이러스 검사 요청종합,2
54,경남 코로나 감염 첫 한자릿수명 또 확진,2
55,경남 명 추가 확진선교회 교육시설 관련 등,2
56,고양시 무도장식당서 집단감염방역수칙 위반 조사,2
57,경기 명 신규 확진고양 무도장 명 추가 감염,2
58, 판사사찰 무혐의 처분감찰부 직권남용 성립 어렵다,2
60,보육교사 모두가 아이 학대하며 즐겨 그곳은 지옥이었다,2
61,고기 구워먹던 학대 교사들 어린이집은 지옥이었다,2
62,해외서 유입된 변이 바이러스 추가 감염 명누적 명,2
63,변이 바이러스 건 급증건 경남전남 외국인 집단감염,2
64,박근혜 코로나 격리 일만에 퇴원서울구치소 복귀,2
66,고양시의회 동물복지연구회 출범조례개정 검토,2
67,동물 학대 처벌 강화된다맹견 소유자 책임보험 가입 필수,2
68,질병청 아스트라제네카 백신 일부터 접종 시작,2
70,대낮에 주행 중인 차량 가로막고 집단폭행,2
71,대낮에 차량 습격러시아인 추정 명 무차별 폭행 영상,2
72, 서울교육청  과정중심평가 성적 반영되지 않아일문일답,2
73, 튜터 서울 학생들 맞춤형 학습 돕는다,2
74,이선호 울주군수 벌금 만원 군민 위해 최선 다하라는 뜻,2
75,국민의힘 박성민 의원 벌금 만원 의원직 유지,2
76,서울시 임시선별검사소 개소 설 연휴에도 운영 결정,2
77,서울시 임시선별검사소 개소 설 연휴에도 운영한다,2
78,경찰 설 연휴 갓길통행 등 법규 위반 집중 단속,2
79,경기남부경찰 설 연휴 특별교통관리대책 추진,2
80,서울역 묻지마 폭행 대 징역 년 개월 실형법정구속,2
81,서울역 묻지마 폭행 대 심서 징역 년개월,2
82,서울역 묻지마 폭행 대 징역 년 개월법정구속,2
83,서울역 폭행 대 징역 년 개월법정구속,2
84,공무원 사망 서울시유족 고인 향한 억측 삼가달라,2
85,서울시 공무원 사망 사건 보도 자제 요청유족 원치 않아,2
86,숨진 채 발견된 서울시립미술관 급 대 공무원 유퀴즈 출연자 맞다종합,2
87,서울시 급 공무원 유퀴즈 출연 당시저 사람도 안 잘려 종합,2
88,이모 집 욕조서 숨진 살 여자 어린이는 물고문까지 당했다,2
89,이모 집 욕조서 숨진 살 여자 아이온몸에 멍자국,2
90,욕조에서 숨진 살 아이잔혹했던 이모 부부의 만행,2
91,몸에 멍 자국 살 여아 욕조서 숨져이모 부부 긴급체포,2
92,일 아스트라제네카 백신 접종 시작요양병원시설 먼저,2
93,아스트라제네카 고령층 논란 지속접종 차질 우려종합,2
95,백신 일부터 공급바이오사이언스 공장 출하,2
96,코로나 변이 바이러스 건 추가총 건,2
97,해외발 변이 바이러스 확산 비상명 추가 발생,2
98,부천 종교시설학원 등에서 명 집단감염 발생,2
99,보 부천 종교시설보습학원서 명 코로나 집단감염,2
100,선거법위반 박성민이선호 직위상실 면해선출직 재판 일단락,2
102,경산시공무원노조 설맞이 청렴캠페인 실시,2
103,한국부동산원 설 명절 반부패청렴캠페인 실시,2
105,고기파티 인천 국공립어린이집 교사들 학대 상습적영장 검토,2
106,설 연휴 평년보다 포근하지만 안개 주의해야,2
107,설 연휴 맑고 포근짙은 안개 귀성길 운전 주의,2
108,백운규 영장 기각에 당혹스러운 검찰윗선 수사 차질 불가피,2
109,민주당 백운규 구속영장 기각은 당연국민 검찰로 거듭나야,2
110,정권 임원 물갈이 사표 요구환경부 블랙리스트 김은경 실형 이유종합,2
111,환경부 블랙리스트 김은경 전 장관 구속징역 년 개월,2
112,삼척 신기면 산불 헬기 대 투입 진화 중 소실보,2
113, 삼척 신기 서하리 야산 산불 발생삼척,2
114,명단엔 없는 확진자고양 태평양무도장서 명 집단감염,2
115,고양시 무도장인근 식당 방역수칙 위반방문자 기록 허술,2
116,광주 코로나 명 추가 확진백신 접종 준비 착착,2
118,대구시 취약계층 피해 업종 지원 위해 조억원 푼다,2
119,대구시 코로나 경제방역 조억원 지원일자리긴급복지 지원대책,2
120,이틀전부터 때렸다는데 일주일 전에도 아이 울음 들었다,2
121,또 아동학대살 조카 이모 부부 폭행물고문에 숨졌다,2
122,멍든채 욕조서 숨진 여아이웃들 주로 혼자 있었던 기억,2
123,얼굴 수차례 물속에살 여아 이모 부부 학대 인정,2
124,서울시 대 공무원 극단선택서울시 직장 괴롭힘 없었다,2
125,서울시립미술관 직원 사망선 진실 밝혀달라 봇물,2
126,앞날 창창한데 대 급 공무원 사망 소식에  애도 물결,2
127,서울시립미술관 사망 경위 조사중 출연자 맞는지는 밝힐 수 없어,2
128,아스트라제네카 백신 일부터 접종 시작,2
129,아스트라제네카 백신 일 접종 개시요양병원시설 우선 대상,2
130,러시아 백신도 검토아스트라제네카 일 도입,2
131,백신 접종 유럽 최소 개국서 세 미만에 권고,2
132,예방접종 대응 추진단 화이자 백신 접종 합동 모의훈련 시행,2
133,우리나라 코로나 백신 접종은 이렇게백신 접종 모의훈련,2
134,대구시 호 코로나 백신 접종센터 동산병원 별관,2
135,대전시민  코로나 백신 안전성 확인 후 접종,2
136,월성원전 의혹 백운규 구속심사 종료결과는 일 새벽 나올듯,2
137, 향하던 원전비리 수사 장관 영장 기각에  동력 상실,2
138,목포시의원 황제접종 보건소 직원 벌금형,2
139,목포시의회에 출장 독감 예방접종 보건소 공무원 명 벌금형,2
140,동물 학대 처벌 강화유기 시 과태료서 벌금형으로,2
141,잔혹 동물학대에 동물보호법 촘촘해진다,2
142,학력부진 학생에  튜터 붙인다,2
143,조희연  융합맞춤수업으로 미래인재 양성한다,2
144,수도권 임시검사소 익명검사 명 확진수도권 지역발생의 ,2
145,임시선별진료소 일부 축소 운영실명검사로 전환,2
146,국민 아기욕조 안전 부적합 논란명 집단소송,2
147,환경호르몬 아기욕조 피해자 천 명 집단소송,2
148,현대중공업 노조 사망 사고 당시 안전지침 불이행,2
149,노동부 노동자 사망사고 발생 현대중공업 집중감독 착수,2
150,박근혜 구치소로 복귀코로나 격리 병원생활 일만,2
152,부천 명 집단감염최초 확진자는 종교시설 교인,2
153,부천 종교시설보습학원서 명 무더기 확진,2
154,추미애가 저격한 윤석열 판사 사찰 의혹무혐의 결론,2
155, 윤석열 판사사찰 문건 등 직권남용 무혐의 처분,2
156,환경부 블랙리스트 김은경 징역 년개월법정구속,2
157,속보 환경부 블랙리스트 김은경 징역 년 개월 법정구속,2
158,코로나로 폐업 임금 미지급 업주에 무죄,2
159,법원 코로나로 폐업한 뷔페업주 임금 미지급 혐의 무죄,2
160,방역당국 아스트라제네카 백신 일부터 접종 시작,2
161,아스트라제네카 백신 이달 일부터 순차 공급,2
162,아스트라제네카 백신 공급시기 확정오는 일 도입,2
163,속보 질병청 아스트라제네카 백신 일부터 접종 시작,2
165,검찰 윤석열 총장 재판부 사찰 혐의없음 결론,2
166,서울고검  판사 사찰 혐의없음 결론 징계 이어 형사처벌도 불발,2
167,서울고검 판사 사찰 의혹 윤석열 직권남용 무혐의 처분,2
168,유퀴즈 최연소 급 공무원 클립영상 삭제진상규명 촉구 종합,2
169,사망한 서울시 대 급 공무원 유퀴즈 출연자였다최연소 합격,2
170,서울시립미술관 급 대 공무원 자택서 돌연 숨진 채 발견종합,2
171,서울시립미술관 급 대 공무원 숨진 채 발견네티즌 진상 규명 필요종합,2
172,해외발 변이 바이러스 감염자 명 늘었다누적 명,2
174,변이 명 추가 발생해외유입 명지역사회 집단감염 명,2
175,하루 새 코로나 변이 확진자 명 쏟아져 전체 명 넘을 듯,2
176,환경부 블랙리스트 의혹 김은경 전 장관신미숙 전 비서관 오늘 심 선고,2
177,환경부 블랙리스트 김은경신미숙 오늘 심 선고,2
178,수도권 선별검사소 실명검사 전환단계까지 운영 지속,2
180,주행 차량 가로막고 운전자와 동승자 둔기로 폭행 경찰 수사,2
181,차량 막더니 쇠몽둥이 폭행충격적 화성 집단린치,2
182,정말  패듯이 때렸다싱어게인 탑 요아리도 학폭 의혹,2
183,일진 출신  패듯 맞았다싱어게인 요아리 학폭 의혹,2
184,만 의성 쓰레기산 년만에 싹 치웠다,2
185, 보도로 국제 망신 산 의성 쓰레기산 만 폐기물 처리,2
186,제자 때린 고교 아이스하키팀 감독감사 착수,2
187,고교 아이스하키 감독 선수들 폭행 의혹경찰은 무혐의,2
188,부천 종교시설보습학원서 명 집단감염종합,2
189,속보 부천 종교시설보습학원서 명 코로나 집단감염,2
190,박근혜 코로나 격리 일만 퇴원서울구치소 복귀,2
191,박근혜 구치소 복귀태극기 지지자들 믿어요 글썽종합,2
192,제주 전세버스 관광 여행객 확진설 연휴 앞두고 비상,2
193,제주 전세버스 이용 관광객 코로나 확진 동승자 격리,2
194,선거법 위반 박성민 의원 벌금 만원 선고,2
195,선거법 위반 이선호 울주군수 직위상실형 피해,2
197,동물학대 처벌 강화 최대 징역 년  년유기해도 처벌,2
198,용인 살 여아 이모 부부 폭행물고문으로 숨졌다,2
200,육중한 교사가 큰 쿠션으로 아이를 후려치더라이 곳은 지옥영상,2
201,머리채 잡고 주먹으로 얼굴 가격교사 전원 아동학대 가담,2
202,애 머리채 잡아끌고 쿠션으로 후려치고 이곳은 지옥,2
203,아이들 방치하고어린이집서 고기 구워먹은 교사들,2
207,서울고검 윤석열 무혐의 처분,2
208,박범계 법무부장관 변협회장 예방공수처 출범에 큰 역할,2
209,박범계 취임후 변협 첫 예방정의와 인권에 큰 기여,2
210,박범계 이찬희 변협회장 예방공수처 출범에 큰 역할,2
211,박범계 대한변협 회장 예방공수처 출범에 역할 컸다,2
212,영상 경기도 화성서 차량 둔기로 부수고 운전자 폭행 논란경찰 수사나서,2
213,경기 화성서 차 가로막고 집단 폭행경찰 수사 착수,2
214,차량 부수고 운전자 무차별 폭행경기 화성서 폭행 사건 발생,2
215,대낮에 주행 차량 가로막고 둔기로 묻지마 폭행 일당에 네티즌 공분,2
216,부천서 코로나 집단감염 종교단체발,2
217,부천 승리제단 코로나 집단감염 발생,2
218,아스트라제네카 이달 일 공급화이자는 불투명,2
219,당국 화이자 백신 공급 계획에 차질 없어이달 중순 이후,2
220,황제예방접종 목포시 공무원 벌금형,2
221,목포시의원 황제 예방접종 있었다공무원 명 벌금형종합,2
222,서울시 공무원 숨진 채 발견극단적 선택 추정,2
224,백운규 영장 기각검찰감사원언론 여론몰이 안통했다,2
225,백운규  장관 구속영장 기각 수사지휘 했던 윤석열 부담 커져,2
227,동물 잔인하게 죽이면 최고 징역 년학대 처벌 강화,2
228,요아리 하지 않은 학교 폭력 어떻게 증명해야 할지,2
230,박근혜 코로나 최종 음성판정서울구치소 복귀,2
231,입원 일 만에 박근혜 오늘일 오후 서울구치소로 이송,2
232,일산 태평양무도장 제의 이태원 클럽 되나,2
233,고양 주엽동 무도장식당서 명 집단감염방문자 검사 요망,2
234,속보 살 조카 욕조에 머리 담갔다경찰 이모 부부 영장 신청 예정,2
235,욕조에 머리담가 고문초등생 조카 학대치사 부부 영장종합,2
236,대학교 연구실 안전기준 마련산재보험 법 개정 추진,2
237,과기부교육부 맞손대학 연구실 사고예방 협력,2
238,환경부 블랙리스트 김은경 전 장관 징역 년월 법정구속,2
240,일가족 명 숨진 지난해 설날 참변동해 펜션 업주 실형,2
241,가스 마감 조치 소홀 설날 가스폭발 동해 펜션 업주 법정구속,2
242,설날 명 숨지게 한 동해 가스 폭발 사고 펜션 업주 법정구속,2
243,지난해 설날 명 숨지게 한 강원 동해시 토바펜션 업주 법정구속,2
244,부천 승리제단오정능력학원 명 집단 감염집합금지전수조사,2
245,부천 종교시설보습학원서 명 집단감염,2
247,부천 명 감염 최초 확진자는 승리제단 교인추가 확산 가능성,2
248,월성 원전 의혹 백운규 구속영장 기각청와대 윗선 수사 제동,2
249,월성원전 의혹 백운규 구속기각윗선 노린  수사도 차질,2
251,백운규 전 산업부 장관 영장심사 시간 만에 종료 내일 새벽 구속 여부 결론날 듯,2
252,설연휴 큰 추위 없어안개일교차 주의,2
254,설 연휴 평년보다 따뜻낮 최고 도 넘어,2
255,설 연휴 내내 낮엔 따뜻 밤엔 꽁꽁일교차 도,2
256,환경부 블랙리스트 폭로 년개월만에 유죄 선고,2
257,환경부 블랙리스트 김은경 징역 년 개월법정 구속,2
258,정 총리 월말 국내 생산 백신으로 접종 시작화이자백신은 월말월초 도입,2
259,정 총리 화이자 백신 월 말월 초 도입최초는 아스트라제네카,2
260,고속도로 통행료 수납원 전면 파업하이패스 차로만 이용 가능,2
261,속보 내일부터 톨게이트 수납원 총파업하이패스만 통과,2
262,충남도 설 연휴 시간 응급진료체계 가동,2
263,설 연휴 문 여는 병원약국은 어디   에 전화하세요,2
264,이모에 맡겨진 살 여아물고문 정황,2
265,이틀간 때리고 물고문 정황까지이모집 욕조서 숨진 세 여아,2
267,요아리 해명 학폭 의혹에 사실 낙인 찍혔지만 최대한 대응할 것전문,2
268,서울고검 판사 사찰 의혹 윤석열 무혐의 처분,2
269,서울고검 윤석열 판사 사찰 무혐의 처분 종합,2
270,호남권역예방접종센터 준비 끝이달 말 의료진부터 접종,2
271,춘천시 코로나  백신 접종 준비,2
272,국제 망신 의성 쓰레기산 치웠다만 처리에 든 돈은,2
273,의성 쓰레기산 년 개월 만에 사라졌다만천 처리,2
274,매일 목욕시켰는데 국민 아기욕조 피해자 집단소송,2
275,환경호르몬 아기욕조 피해자 명 집단소송 매일 썼는데,2
277,동물학대 멈춰주세요벌금 만원 처벌 강화,2
278,고기파티 인천 국공립어린이집 교사들 학대 상습적영장 검토종합,2
279,장애아동 학대한 인천 서구 국공립 어린이집 교사들 고기파티까지 했다,2
280,서울역 묻지마 폭행 남성 실형법정구속,2
281,서울역 묻지마 폭행 심서 징역 년 개월법정구속,2
282,서울역 묻지마 폭행 대 징역 년 월 법정구속,2
284,정읍 시민단체 라벤더 허브원 특혜 정읍시장 사과를,2
285,정읍라벤더허브원 지자체 특혜 의혹진상 조사하라,2
286,정읍 라벤더허브원 인가 절차 부적정사업 중단해야,2
287,라벤더허브원 지자체 특혜 의혹정읍시 민선 기 일종합,2
288,박범계김진욱 첫 상견례막중한 책임 잘해달라종합,2
289,박범계 김학의 사건 이첩 공수처장과 검찰총장 해결할 문제,2
291,박범계김진욱 첫 상견례막중한 책임 잘해달라,2
292,김영호 반려동물 대상 잔혹범죄 처벌 강화,2
293,동물학대 처벌 강화잔인하게 죽이면 징역 년,2
294,동물 학대 처벌 강화잔인하게 죽이면 년 이하년 이하 징역,2
296,백신 시간표 나왔다아스트라제네카 일 접종,2
297, 백신 고령자 접종 의사들에 물어보니지켜봐야긍정 효과 커,2
298,화이자 코로나 백신 접종 모의훈련 해보니분에 명 접종 목표,2
299,첫 냉동 백신 화이자 접종 어떻게 진행되나실제같은 모의훈련,2
300,진주시장지역 국회의원 국토안전관리원 교육센터 이전 안 돼,2
301,진주 국토안전관리원 교육센터 이전 추진에 반발 거세,2
302,환경부 블랙리스트 김은경 장관 법정구속,2
303,환경부 블랙리스트 김은경 전 장관 법정구속,2
304,고양시 방역수치 위반 무도장식당 행정처분,2
305,무도장발 집단감염명단에 없는 확진자 속출,2
306,수도권 임시검사소 실명검사로 전환단계까지는 운영 계속,2
307,방역당국 수도권 임시선별검사소 실명검사로 전환,2
308,욕조빠져 숨졌다던 살 이모부부 폭행물고문했다,2
309,욕조서 숨진 살 아이 온몸에 멍이모 부부 가볍게 몇 번 때렸다,2
310, 윤석열 겨냥 백운규 영장기각 계기로 원전수사 중단해야,2
311,국민 위한 결정 기각 당연검찰 수사 더 철저히,2
312,장애아동 걸레로 얼굴 때리고 머리채 잡아끌고 인천 학대 어린이집 피해부모 호소,2
313,고기파티 인천 국공립 어린이집 교사들 학대 상습적영장 검토,2
314,윤석열 징계 부른 판사 사찰 의혹 검찰서 무혐의,2
315,윤석열 재판부 분석 문건 사건 검찰 무혐의 처분,2
317,박근혜 코로나 밀접접촉 후 성모병원 격리 일만 서울구치소 복귀,2
318,극단선택 서울시 급 공무원 유퀴즈 출연자 맞다,2
319,서울시립미술관 대 공무원 사망유족 측 억측 삼가 요청,2
320,백운규 전 산자부 장관 구속영장 기각에 제동걸린 검찰수사여야 공방은 더 과열,2
321,백운규 월성 조기폐쇄는 국정과제 영장심사,2
322,백운규 영장기각 사유는 부하들 진술 확보해 구속할 이유 부족,2
324,현행 단계 거리두기단계로 줄여야방역수칙 강화하되 집합금지 최소화,2
325,단계는 신속성 떨어져생활방역단계 전환을,2
326,거리두기 단계까지는 영업제한 자정 이후로 늦추자,2
327,단계로 줄이고 기준 간단하게 중수본 거리두기 개편 논의,2
329,서울고검 판사 사찰의혹 윤석열 무혐의 결론,2
330,서울고검 윤석열 판사 분석 문건 무혐의 처분,2
332,경기 포천 산란계 농장 고병원성  확진국내 번째,2
333,충북 음성 종오리 농장서 고병원성  의심사례 발생,2
334,경기 포천 산란계 농장서도 고병원성  발생,2
335,경기 포천 산란계 농장국내 번째 고병원성  확진,2
336,아스트라제네카 일부터 접종 시작모의훈련 실시,2
337,정총리 화이자 백신 월 말월 초 국내 도입 예상,2
338,정부 오늘 코로나 백신 접종 합동 모의훈련 시작,2
339,시간에 명 맞는다해동접종관찰까지 훈련,2
340,고속도로 통행료 수납원 파업 철회요금소 정상 운영,2
341,내일부터 톨게이트 수납원 총파업하이패스만 통과,2
342,내일부터 휴게소서 포장만 가능통행료 유료는 모레부터,2
344,설 연휴 부산 병의원 곳 약국 곳 문 연다,2
345,설 연휴 갑자기 아파도 걱정 마세요문 여는 의료기관 안내,2
346,부산 초량 지하차도 참사 관련 공무원 구속,2
347,지하차도 참사 책임 공무원 명 구속 명 기각,2
348,경남도 문화예술인 활동지원비 지급 경남도,2
349,김해시 문화예술인지원금 수혜자 대폭 확대  작년 배,2
350,노동자 사망 반복 현대중공업고용부 일까지 집중 감독,2
352,환경부 블랙리스트 김은경 심 유죄 불복곧장 항소,2
353,환경부 블랙리스트 김은경 징역 년월 언급 않겠다,2
354,안양시 소상공인 행복지원자금으로 억 푼다,2
355,안양시 소상공인 행복지원자금 억 준비오는 일부터 월일까지 신청접수,2
356,부천 종교시설보습학원 명 코로나 집단감염,2
357,이번엔 영생교부천 승리제단이 촉발한 명 감염,2
358,아기 욕조서 기준치 배 유해물질 피해자들 집단소송,2
359,발암물질 아기욕조 피해자 집단소송,2
360,부천 모 종교시설보습학원서 명 코로나 집단감염,2
362,이번엔 영생교발 집단감염근처 학원까지 명 확진,2
363,부천 보습학원교회 명 집단감염,2
364,부산경찰청 설 명절 앞둔 일 대대적 음주단속,2
365,경기교육청 음주운전 근절 전담팀 년간 운영,2
366,연휴엔 더 조심 부산경찰 오늘 야간 음주 단속 실시,2
367,네 번째 음주운전인데 집유 피해 경미하고 피해자와 합의,2
368,속보 코로나 어제 명 추가다시 명대,2
369,속보 엿새만에 다시 백명 대 신규 확진국내 발생 가 수도권,2
370,속보 코로나 신규 확진 명집단감염변이 확산에 명 재돌파,2
371,신규 환자 명엿새 만에 명대 증가,2
372,환경부 블랙리스트 김은경 전 장관 심서 징역 년 월 법정구속,2
374,환경부 블랙리스트 김은경 전 장관 법정 구속,2
375,속보 법원 환경부 블랙리스트 업무방해 혐의도 인정,2
376,아스트라제네카 일부터 국내 접종요양병원 입소자 투약,2
378,부산 지하차도 참사 책임 공무원 명 중 명 구속,2
379,직원 구속 위기 부산 동구청 침통꼬리 자르기 비판도,2
380,대검 윤 총장 김 처장 취임 축하하면서 공수처 원활한 운영 위해 적극 협력하기로 했다,2
381,김진욱 만난 박범계 공수처법무부 유기적 협조 관계 도모,2
382,서울시립미술관 숨진 급 공무원 부서변경 요구 없었다종합,2
383,사망한 대 급 공무원 엔 곁에 있어줘 고마워,2
