,title,type
384,동물 잔인하게 죽이면 년 이하 징역,2
385,동물 학대 처벌 강화최대 징역 년,2
386,용의자 정보 안 준 쏘카 부모 울먹초등생 성폭행 녹취록,2
387,쏘카 세 소녀 성폭행 관련 용의자 정보 제공 비협조 논란에 사과 전문,2
388,거리두기 단계 줄이고 기준 간단하게 고치자,2
389,모임금지 인 세분화거리두기 체계 개편 논의,2
390,서울시교육청 중등교사 명 최종합격여성 비율 ,2
391,충북 중등교사도 여성 초강세임용시험 합격  차지,2
392,고속도로 통행료 수납원 파업 철회톨게이트 정상 운영,2
393,고속도로 요금소 수납원 총파업 예고하이패스 차로만 이용 가능,2
394,월성 원전 의혹 백운규 전 장관 구속영장 기각검찰 수사 제동,2
395,백운규 구속 불발로 수사 급제동설 이후 청와대 정조준,2
396,대법 억 사기 임동표 전  회장 징역 년 확정,2
397,억대 사기  전 회장징역 년벌금 억 확정,2
398,경찰 이용구 사건 서초서 관계자들 휴대전화 분석,2
399,경찰 이용구 무마 의혹 서초서 수사관 교체 전 폰도 디지털 포렌식,2
400, 자문단 아스트라제네카 세 이상 접종해도 괜찮다,2
401,질병청 오늘 아스트라제네카 백신 접종 계획 관련 논의,2
402,아스트라제네카 백신 국내 첫 허가세 이상도 포함종합,2
403,식약처 아스트라제네카 백신 사용 허가살 이상도 포함,2
404,모든 해외 입국자 일부터  음성확인서 의무화,2
405,변이 확산 비상일부터 입국 내국인 음성 확인서 제출해야,2
406,전남도 변이바이러스 방역체계 강화일에 한번씩 검사,2
407,일부터 모든 국내 입국자  음성확인서 제출해야,2
408,광양 가야산 불 시간 넘게 이어져,2
409,광양 가야산 화재 이틀째 진화작업산림피해  추정,2
410,광양 가야산 화재 진화 작업 시간 넘게 이어져 진화,2
411,광양 가야산서 산불거센 바람에 진화 난항,2
412,장애인단체 시위로 서울 호선 한때 지연 운행,2
413,장애인단체 호선 휠체어 시위퇴근시간 운행 차질,2
414,지하철 호선 장애인 시위 종료여파로 아직 운행 지연종합보,2
415,객실에 갇혀 휠체어 시위로 호선 지연시민들 불만폭주,2
416,대전시 서유성대덕구드론특구 선정,2
417,원주시 드론 특별자유화구역 공모 선정,2
418,신규확진 명 보름만에 명대영생교 관련 명 추가 확진종합,2
419,대구시 코로나 신규 확진 명  동구북구 차 감염 이어져,2
420,귀성길 첫 점심시간 휴게소 음식 포장만 돼요,2
421,설 연휴 고속도로 휴게소 음식 포장만 가능 통행료도 유료,2
422,살 조카 물고문한 이모 엔 제가 때려서 물에 빠뜨,2
423,속보 세 조카 물고문 사망사건 이모 부부 구속영장 발부,2
424,이재영이다영 사과문 본 피해자 글 하나로 년 세월을반성하며 살아가길,2
425,여자 배구선수 학폭 의혹 일파만파 피해자 사과 원한다,2
426,구미 빌라서 살된 여아 사체 발견사라진 친모 잡혀종합,2
427,구미서 세 여아 부패한 시체로 발견부모는 집 나가,2
428,만취 경찰 간부 호텔서 성희롱 발언에 폭행까지,2
429,경찰이 또 만취해 호텔 직원에 술 같이 먹자 행패,2
430,속보 정인이 사건 부실 수사 관련 경찰관 명 중징계종합,2
431,정인이 사건 차 출동 경찰관 명정직 개월 징계,2
432,편의점에 차몰고 돌진한 대 징역 년 월,2
433,딸 그림 누락 앙심 편의점에 차몰고 돌진한 대 징역 년월,2
434,귀성길 고속도로 정체 서울에서 부산까지 시간분,2
435,설 연휴 첫날 고속도로 정체 시작서울부산 시간분,2
436,이재명 경기도 차재난기본소득도민  잘했다,2
437,경기도민 열에 일곱 차 재난기본소득 잘 지급했다,2
438,속보 코로나 어제 명 신규확진보름만에 다시 명대로 급증,2
439,설날연휴 첫날부터 신규확진 명 재확산 우려 증폭수도권이 ,2
440,서울 초미세먼지주의보실외활동 줄이고 마스크 착용해야,2
441, 경기도충남 북부 초미세먼지주의보 발령날씨,2
442,경기 개 시 초미세먼지주의보미세먼지보다 더 위험,2
443,인천강화 초미세먼지주의보동남부서부영종 등 주의보 유지,2
444,오후 귀경길 일부 정체 시작부산서울 시간분 예상,2
445,설날 오전 고속도로 곳곳 정체서울부산 시간분,2
446,아직 고속도로 정체 없어오후 시시 꽉 막힐 듯,2
447,설 당일 오후 전국 주요도로 귀경 차량으로 정체,2
448,생후 주 아이 학대로 사망추궁하자 토해서 때렸다,2
449,생후 주된 갓난아이 숨지게 한 부모영장실질심사 위해 이동,2
450,얼굴 멍든채 숨진 생후주 아기부모 분유 토해서 때렸다,2
451,분유 토했다며 생후 주 갓난아기 사망케 한 부모 구속,2
452,여성이 내 지갑에 손대 성매수한 공무원 경찰에 입건,2
453,채팅앱 통해 성매매대가 놓고 다툰 남녀 동시 입건,2
454,앱으로 만나 성매매돈 제대로 못받았다 신고했다가 덜미,2
455,채팅앱 성매매 대가 놓고 다투다 여성이  신고,2
456,낮 최고 도 전국 주말까지 포근한 봄 날씨미세먼지 곳곳 나쁨,2
457,전국 대부분 미세먼지 나쁨제주 오후부터 빗방울,2
458,코로나 신규확진 명수도권 영업제한 오후 시로종합,2
459,코로나 어제 명 신규확진나흘만에 다시 명대로,2
460,진용 갖추는 공수처 인사위 구성이 관건,2
461,공수처 지원자 몰려 월 호수사정권 사수처 불식하려면,2
462,사법농단 법관 명 중 임성근만 탄핵 소추이유는,2
463, 최기상 법관 탄핵 민주주의 한 단계 발전 계기법조여의도,2
464,과장광고로 번 돈대법원 형법 적용해 추징은 불가능,2
465,예금채권도 몰수추징 대상 될까대법 물건만 해당,2
466,강원지역 고속도로 대체로 소통 원활,2
467,대구경북 고속도로 소통 원활,2
468,원격수업 학력격차 해소경기도 초등학생 디지털 교육 지원,2
469,코로나 시대 슬픈 자화상부모 소득 높을수록 자녀 사교육 기회,2
470,다시 백 명대내일 거리두기 조정안 발표,2
471,내일 거리두기 조정안 발표 정부 고민 이유는,2
472,거리두기 단계 하향수도권 영업제한 밤시로 완화인 제한은 유지,2
473,모레부터 수도권 밤 시까지 영업인 모임 금지는 유지 종합,2
474,일본군 위안부 피해자 정복수 할머니 별세남은 생존자 명,2
475,위안부 피해 최고령 생존자 정복수 할머니 별세종합,2
476,조국 중대범죄수사청 설립으로 수사기관 대 분립체계 기원,2
477,검찰 해제 수순 돌입하나 월국회서 검찰수사권 박탈 입법키로,2
478,구미서 숨진 채 발견된 세 여아어머니 구속 도주 우려,2
479,빈집서 숨진 두살 아이 엄마는 새살림 차려 양육수당 챙겼다,2
0,제천시 드론 특별자유화구역 공모에 청풍면 등 선정,2
1,충북도 규제없는 드론시대 선도,2
2,창원시 드론산업 중심지 발돋움 창원시,2
3,제천 청풍금성한수면 드론 특별자유화구역 지정,2
4,소방관이 꿈 초등생이 소화기로 식당 화재 초기 진압,2
5,소방관 될래요 대형화재 막은 초등생의 침착한 대처,2
6,내 꿈은 소방관초등학생이 음식점 화재 진압,2
7,내 꿈은 소방관 소화기로 초기화재 진압한 초등생,2
8,장준하 선생과 군법재판 받는 백기완 소장,2
9,백기완 선생 별세년 그의 발자취를 따라가다,2
10,강경대 열사 주기 추모식에 참석한 고 백기완 소장,2
11,민주화운동 큰 별 백기완 선생 영면향년 세,2
12,속보 세월호 구조 실패 김석균 전 해경청장 등 해경 지휘부 심 무죄,2
13,세월호 구조 실패  판단은 김석균 등 당시 지휘부 일 심 선고,2
14,세월호 구조실패 혐의 김석균 전 청장 심서 무죄 선고,2
15,세월호 구조 실패 김석균  해경청장 심서 무죄업무상 과실 인정 어려워,2
16,서울서 첫 반려동물 코로나 확진 나왔다,2
17,서울서 첫 반려묘 확진구토 증상 사람에 전파 증거 없다,2
18,빌라 옥상서 여년 방치된 시신 발견경찰 수사,2
19,서울 동대문구 주택 옥상서 미라화된 시신 발견,2
20,숨진 세살배기 엄마 아이와 사는 척하며 수당 만원 챙겼다,2
21,방치돼 숨진 구미 세 여아 미스터리아래층 외조부모 왜 몰랐나,2
22,집단감염 선교회 압수수색경찰 방호복 중무장,2
23,경찰 코로나 집단감염 대전 선교회 압수수색,2
24,설 연휴 방역수칙 위반 신고 천여 건가족모임 신고도 천 건,2
25,설연휴 방역수칙 위반 신고 천여건가족모임 신고도 천건,2
26,속보 최신원 네트웍스 회장 억대 횡령 배임 혐의 사전 영장,2
27,검찰 비자금 조성 의혹 최신원 회장 구속영장 청구,2
28,이용구 폭행 부실수사 의혹 관련 경찰관 명 조사,2
29,이용구 봐주기 진상조사 경찰 조사대상 명명 대폭 확대,2
30,정은경 노바백스 만명분 계약 마무리 단계 러시아 백신 검토 단계,2
31,정은경 고령층 접종 분기 접종 예상노바백스 추가 계약 막바지,2
32,사법농단 이민걸이규진 이번주 심 선고,2
33,사법행정권 남용 의혹 이민걸 재판 다시변론재개 신청,2
34,신문 발전기금 유용 혐의 허석 순천시장 심 직위상실형,2
35,속보 허석 순천시장 직위상실형신문 발전기금 유용 혐의,2
36,이용구 사건 흡사택시기사 폭행 승객 항소심서 유죄,2
37,술 취한 경찰관 마스크 착용 요청한 택시 기사 폭행,2
38,벌금형에도 년간 관리소장 괴롭힌 입주민 집행유예,2
39,오피스텔 관리소장 협박폭행한 입주민 만원 배상해야,2
